artwork_id,artist_name,title,exhibition_history,is_on_view,date,category_titles,artwork_type_title
78503,"Tsugouharu Foujita
Japanese, 1886–1968",Portrait of Emily Crane Chadbourne,"New York, Reinhardt Galleries, Exhibition of Paintings and Drawings by Foujita, November 8–28, 1930, n.p., cat. 19, as Portrait.

Tokyo, The Asahi Shimbun, Retrospective Léonard Foujita: A Retrospective Commemorating the 50th Anniversary of his Death, July 31–Oct. 8, 2018, cat. 31; traveled to Kyoto, The National Museum of Modern Art, Oct. 19–Dec. 16, 2018.",False,1922,Modern Art,Painting
53045,"André Lhote
French, 1885-1962",Port of Bordeaux,"The Art Institute of Chicago, Henri Cartier-Bresson and the Art and Photography of Paris, September 20, 2008–January 4, 2009.",False,1914,Modern Art,Painting
217464,"Gladys Nilsson
American, born 1940",The Trogens,,False,1967,Contemporary Art,Painting
93345,"Robert Smithson
American, 1938–1973",Chalk-Mirror Displacement,"London, Institute of Contemporary Art, “When Attitudes Become Form,” September 26–October 27, 1969 (destroyed). A photograph of the installation was shown at the earlier venue, Kunstalle Bern, March 3–April 27, 1969.

New York, John Weber Gallery, “Robert Smithson: Sculpture 1968–69,” October 10–31, 1987, n.pag. (ill.)

Oslo, Norway, National Museum of Contemporary Art, “Robert Smithson: Retrospective  • Works 1955-1973,” February 27–May 2, 1999; traveled to Modern Museum Stockholm, June 19–September 12, 1999, Arken Museum of Modern Art Ishøj, October 2, 1999–January 16, 2000, cat. 133 (no ill.), p. 289 (as “exhibition copy”).

Los Angeles, Museum of Contemporary Art, “Robert Smithson,”September 12–December 13, 2004; traveled to Dallas Museum of Art, January 14–April 3, 2005, New York, Whitney Museum of American Art, June 23–October 16, 2005, pp. 28, 166 (color ill.), 268 (as “Chalk-Mirror Displacement, 1969/2004, Exhibition copy”).",False,1969,Contemporary Art,Sculpture
266051,"Ingrid Pollard
British, born 1953",The Boy Who Watches Ships Go By,,False,2002,Photography and Media,Photograph
266046,"Ingrid Pollard
British, born 1953",The Boy Who Watches Ships Go By,,False,2002,Photography and Media,Photograph
266044,"Ingrid Pollard
British, born 1953",The Boy Who Watches Ships Go By,,False,2002,Photography and Media,Photograph
74453,"Samuel Meily, Sr. (American, c. 1806 after 1852)
United States, Ohio, Richland County, Mansfield",Coverlet,"Art Institute of Chicago, American Coverlets, July 14–Oct. 14, 1973.",False,1842,Textiles,Textile
14485,"Howard Dearstyne
American, 1903–1979",Untitled [Broken Glass],,False,1940/62,Collected by Hugh Edwards,Photograph
14517,"Howard Dearstyne
American, 1903–1979",Untitled (Stalks in Icy Water),,False,c. 1957,Collected by Hugh Edwards,Photograph
14501,"Howard Dearstyne
American, 1903–1979","Rock Bed of Yellow Creek Between Tapoco and Santeelah Lake, N.C.",,False,1940/62,Collected by Hugh Edwards,Photograph
147301,"Yasuhiro Ishimoto
Japanese, born United States, 1921–2012",Interior of the Shokintei Tearoom,,False,1954,Photography and Media,Photograph
147271,"Yasuhiro Ishimoto
Japanese, born United States, 1921–2012",Middle Shoin Seen From the First Room of the Old Shoin,,False,"1954, printed later",Photography and Media,Photograph
147250,"Yasuhiro Ishimoto
Japanese, born United States, 1921–2012",Rock Path in Front of the Old Shoin,,False,1954,Photography and Media,Photograph
263115,"Katsuhiro Yamaguchi (Japanese, 1928-2018)
and Kiyoji Otsuji (Japanese, 1923-2001)",APN no tameno kousei (Composition for APN),,False,1953,Photography and Media,Photograph
270271,"Nicholas Nixon
American, born 1947","The Brown Sisters, Ipswich, Massachusetts",,False,1982,Photography and Media,Photograph
270273,"Nicholas Nixon
American, born 1947","The Brown Sisters. Truro, Massachusetts",,False,1984,Photography and Media,Photograph
270272,"Nicholas Nixon
American, born 1947","The Brown Sisters, Allston, Massachusetts",,False,1983,Photography and Media,Photograph
270275,"Nicholas Nixon
American, born 1947","The Brown Sisters, Cambridge, Massachusetts",,False,1986,Photography and Media,Photograph
270274,"Nicholas Nixon
American, born 1947","The Brown Sisters, Brighton, Massachusetts",,False,1985,Photography and Media,Photograph
270277,"Nicholas Nixon
American, born 1947","The Brown Sisters, Wellesley, Massachusetts",,False,1988,Photography and Media,Photograph
270276,"Nicholas Nixon
American, born 1947","The Brown Sisters, Chatham, Massachusetts",,False,1987,Photography and Media,Photograph
270278,"Nicholas Nixon
American, born 1947","The Brown Sisters, Cambridge, Massachusetts",,False,1989,Photography and Media,Photograph
108897,Portugal,Carpet,,False,18th century,Textiles,Textile
88705,England,Panel (For a Sconce),,False,18th century,Textiles,Textile
88703,England,Panel (For a Sconce),,False,18th century,Textiles,Textile
83889,"Willem de Kooning
American, born Netherlands, 1904-1997",Two Women's Torsos,"New York, Sidney Janis Gallery, “Willem de Kooning: Paintings on the Theme of Woman,”  Mar. 16-Apr. 11, 1953, cat. 8, no cat.

New York, Museum of Modern Art, ""New Images of Man,"" 1959-60, pp. 94 (ill.) and 153, cat. 63; traveled to the Baltimore Museum of Art.

New York, Museum of Modern Art, ""Willem de Kooning,"" 1968, p. 165, cat. 127, as ""Two Women;"" traveled to the Tate Gallery, London, Dec. 5, 1968-Jan. 26, 1969.

Chicago, Richard Gray Gallery, ""Willem de Kooning, 1941-1959,"" Oct. 4-Nov. 16, 1974, n.p., cat. 15 (ill.), as ""Two Women.""

Chicago, Museum of Contemporary Art, ""Drawings by Five Abstract  Expressionist Painters,"" Jan. 10-Feb. 29, 1976, n.p., as ""Two Women, c. 1952-53.""

New York, Whitney Museum of American Art, ""Willem de Kooning: Drawings, Paintings, Sculpture,"" Dec. 7, 1983-Feb. 19, 1984, p. 59, cat. 54 (ill.).

Art Institute of Chicago, ""Edgar Degas: Passing on the Tradition: Prints and Drawings,"" Sept. 1, 1996-Jan. 26, 1997, no cat.

Art Institute of Chicago, ""The Broad Spectrum: Color on Paper, Past and Present,"" Sept. 12–Oct. 31, 1999, no cat.

Los Angeles, The Museum of Contemporary Art, ""Willem de Kooning: Tracing the Figure,"" Feb. 10-Apr. 28, 2002, pp. title page (detail), 148 (ill.) and 195, cat. 70, as ""Torsos, Two Women, c. 1952-53;"" traveled to The National Gallery of Art, Washington, D.C., Sept. 29, 2002-Jan. 5, 2003.

Art Institute of Chicago, ""Modern and Contemporary Works on Paper,"" Mar. 24-Sept. 13, 2009, no cat.

New York, Museum of Modern Art, ""de Kooning: a Retrospective"", Sept. 18, 2011-Jan. 9, 2012, p. 267-68, pl. 90.",False,1952,Prints and Drawings,Drawing and Watercolor
270159,"Idelle Weber
American, 1932-2020",Convention Fury,"New London, CT, Lyman Allyn Art Museum, Pop Goes the Easel: Pop Art and its Progeny, Mar. 2–Aug. 10, 2013, no cat. 

New York, Broadway 1602 Harlem, Idelle Weber: Sunny–Works from New York’s Pop Era, Mar. 4–Apr. 30, 2017, no cat.",False,1968,Contemporary Art,Sculpture
59944,"Pierre-Auguste Renoir
French, 1841-1919",The Laundress,"Paris, Galeries Durand-Ruel, Exposition A. Renoir, May 1892, cat. 8, as Laveuse.

Art Institute of Chicago, Exhibition of the Worcester Collection, July 24–Sept. 23, 1923, no cat.

Toledo Museum of Art, Paintings by French Impressionists and Post-Impressionists, Nov. 7–Dec. 12, 1937, cat. 30 (ill.).

New York, Wildenstein, Renoir: A Loan Exhibition for the Benefit of the American Association of Museums in Commemoration of the Fiftieth Anniversary of Renoir’s Death, Mar. 27–May 3, 1969, cat. 37 (ill.).

Art Institute of Chicago, Paintings by Renoir, Feb. 3–Apr. 1, 1973, cat. 31 (ill.).

Atlanta, High Museum of Art, May 25, 1984–May 30, 1985, no cat.

Tokyo, Bridgestone Museum of Art, Renoir: From Outsider to Old Master, 1870–1892, Feb. 10–Apr. 15, 2001, cat. 13 (ill.); Nagoya City Art Museum, Apr. 21–June 24, 2001.

Columbus (Ohio) Museum of Art, Renoir’s Women, Sept. 23, 2005–Jan. 8, 2006, cat. 2.

Fort Worth, Tex., Kimbell Art Museum, The Impressionists: Master Paintings from the Art Institute of Chicago, June 29–Nov. 2, 2008, cat. 25 (ill.).

Cleveland Museum of Art, Degas and the Laundress: Women, Work, and Impressionism, Oct. 8, 2023-Jan. 14, 2024, cat. 51.",True,1877/79,Painting and Sculpture of Europe,Painting
40997,"Designed by Jean Lurçat (French, 1892–1966)
Produced by Maison Myrbor
Algeria or France",Le Jardin (The Garden),"Art Institute of Chicago, Elizabeth F. Cheney and Agnes Allerton Textile Galleries, On or Off the Wall: An International Selection of Tapestries and Carpets, 1920s–1970s, May 14, 2003–Feb. 8, 2004, brochure.",False,1925/26,Textiles,Textile
79586,"Edgar Degas
French, 1834–1917",Portrait of Mme Lisle and Mme Loubens,,False,c. 1867,Painting and Sculpture of Europe,Painting
14572,"Edgar Degas
French, 1834-1917",The Millinery Shop,"The Art Institute of Chicago, Mrs. L.L. Coburn Collection: Modern Paintings and Water Colors, April 6, 1932-October 9, 1932, cat. 9 (ill.).

The Art Institute of Chicago, A Century of Progress Exhibition of Paintings and Sculpture, June 1-November 1, 1933, cat. 286, pl. 53.

Northampton, Mass., Smith College Museum of Art, Edgar Degas, November 28-Deceber 18, 1933, cat. 8 (ill.).

The Art Institute of Chicago, A Century of Progress Exhibition of Paintings and Sculpture, June 1-November 1, 1934, cat. 202.

Toledo, Ohio, Museum of Art, French Impressionists and Post-Impressionists, November 1934, cat. 1.

Springfield, Mass., Museum of Art, French Painting, Cézanne to the Present, December 1935-January 1936, cat. 1.

Philadelphia Museum of Art, Degas, November-December 1936, cat. 40 (ill.).

Worcester, Mass., Worcester Art Museum, The Art of The Third Republic, February-March 1941, cat. 4 (ill. on cover).

Cleveland Museum of Art, The Works of Edgar Degas, February 5-March 9, 1947, cat. 38 (ill.).

Philadelphia Museum of Art, Diamond Jubilee Exhibition: Masterpieces of Painting, November 4, 1950-February 11, 1951, cat. 74 (ill.).

Boston Museum of Fine Arts, Edgar Degas: The Reluctant Impressionist, June 21-September 1, 1974, cat. 20 (ill.).

Richmond, Va., The Virginia Museum, Degas, May 23-July 9, 1978, cat. 14 (ill.).

Albi, Musée Toulouse-Lautrec, Trésors impressionistes du Musée de Chicago, June 27-August 31, 1980, cat. 8 (ill.).

The Art Institute of Chicago, Degas in The Art Institute of Chicago, July 19-September 23, 1984, cat. 63 (ill.).

Paris, Galeries nationales du Grand Palais, Degas, February 9-May 16, 1988, cat. 235 (ill.); Ottawa, National Gallery of Canada, June 16-August 28, 1988; New York, The Metropolitan Museum of Art, September 27, 1988-January 8, 1989.

London, National Gallery, Degas: Beyond Impressionism, May 22-August 26, 1995, cat. 4 (ill.)., traveled to The Art Institute of Chicago, September 28, 1996-January 5, 1997.

Kansas City, The Nelson-Atkins Museum of Art, Invited Work: Edgar Degas, The Millinery Shop, July 22- November 26,  1995, no cat.

London, The National Gallery and The Art Institute of Chicago, Degas: Beyond Impressionism, 1996-1997, cat. 4. 

New York, Metropolitan Museum of Art, The Private Collection of Edgar Degas, October 1, 1997-January 11, 1998, no cat. no (fig. 96). 

Atlanta, High Museum of Art, Degas and America: The Early Collectors, cat. 54 (ill.), traveled to The Minneapolis Institute of Arts, June 16-September 9, 2001, shown in Minneapolis only.

Washington, DC, The Phillips Collection, Impressionist and Post-Impressionist Still-Life Painting, September 22, 2001-January 13, 2002, no cat. no (pl. 60), traveled to Boston, Museum of Fine Arts, February 17-June 9, 2002.

Fort Worth, Tex., Kimbell Museum of Art, The Impressionists: Master Paintings from the Art Institute of Chicago, June 29–November 2, 2008, cat. 41 (ill.).

St. Louis, Missouri, Saint Louis Art Museum, Degas, Impressionism, and the Paris Millinery Trade, February 12 - May 7, 2017, cat. 1; San Francisco, Legion of Honor, June 24 - September 25, 2017.

Paris, Musée d’Orsay, Manet/Degas, Mar. 27-July 23, 2023, cat. 105; New York, Metropolitan Museum of Art, Sep. 12, 2023-Jan. 7, 2024, pl. 125.",False,c. 1879-86,Painting and Sculpture of Europe,Painting
147004,Thailand,Buddha and Companions Riding a Mythical Animal,,False,"Dvaravati period, 8th century",Arts of Asia,Sculpture
198303,"Ellsworth Kelly
American, 1923-2015",Tableau Vert,,False,1952,Contemporary Art,Painting
185779,"Ellsworth Kelly
American, 1923-2015",Train Landscape,,False,1953,Contemporary Art,Painting
81533,"Édouard Manet
French, 1832-1883",The Races at Longchamp,"Paris, Ecole Nationale des Beaux-Arts, Exposition des Oeuvres de Edouard Manet, January 1884, cat. 61.

New York, Durand-Ruel Galleries, Exposition of Paintings by Edouard Manet, 1895, cat. 27.

The Art Institute of Chicago, A Century of Progress:  Exhibition Painting and Sculpture, June 1-November 1, 1933, cat. 332.

The Art Institute of Chicago, A Century of Progress:  Exhibition Painting and Sculpture, June 1-November 1, 1934, cat. 252.

New York, Wildenstein & Co., Edouard Manet: A Retrospective Loan Exhibition for the Benefit of French Hospitals, March-April, 1937, cat. 18 (ill.).

Cambridge, Mass., The Fogg Museum of Art, Harvard University, The Horse: Its Significance in Art, April 20-May 2, 1938, cat. 14 (ill.).

Detroit Institute of Arts, The Age of Impressionism and Objective Realism, May-June, 1940, cat. 20

New York, Wildenstein & Co., From Paris to Sea Down the River Seine, January-February, 1943, cat. 18 (ill.).

Richmond, Va., Virginia Museum of Fine Arts, Sport and the Horse, April 1-May 15, 1960, cat. 58.

Sarasota, Florida, John and Mable Ringling Museum of Art, Palmer Family Collections Exhibition, February 23-March 24, 1963, cat. 13.

Rochester, New York, The Rochester Memorial Art Gallery of the University of Rochester, In Focus: A Look at Realism in Art, December 28, 1964-January 31, 1965.

The Philadelphia Museum of Art, Manet, November 3-December 11, 1966, cat. 68 (ill.), traveled to The Art Institute of Chicago, January 13-February 19, 1967, shown only in Chicago.

Albi, Musée Toulouse-Lautrec, Trésors Impresionsistes de Museé de Chicago, June 27-August 31, 1980, cat. 2 (ill.).

Washington D.C., National Gallery of Art, Manet and Modern Paris, December 5, 1982-March 6, 1983, cat. 43 (ill.).

Paris, Galeries Nationales du Grand Palais, Manet, April 22-August 1, 1983, cat. 99 (ill.), traveled to New York, Metropolitan Museum of Art, September 10-November 27, 1983.

The Art Institute of Chicago, Manet as Printmaker: Works From the Permanent Collection, April 20-September 12, 1985, no cat.

Tokyo, Seibu Museum of Art, The Impressionist Tradition: Masterpieces from the Art Institute of Chicago, October 18- December 17, 1985, cat. 17 (ill.), traveled to Fukuoka Art Museum, January 5-February 2, 1986 and Kyoto Municipal Museum of Art, March 4-April 13, 1986.

The Art Institute of Chicago, Chicago’s Dream a World’s Treasure: The Art Institute of Chicago, 1893-1993, November 1, 1993-January 9, 1994, no cat. no., pl. 11.

Paris, Galeries Nationales du Grand Palais, Impressionnisme: Les origines, 1859–1869, April 19–August 8, 1994, cat. 106; New York, Metropolitan Museum of Art, Origins of Impressionism, September 27, 1994–January 8, 1995.

London, National Gallery, Impression: Painting Quickly in France, 1860-1890, November 1, 2000-January 28, 2001, no cat. no. (ill.); Amsterdam, Van Gogh Museum, March 2-May 20, 2001; Williamstown, Mass., Sterling and Francine Clark Art Institute, June 16-September 9, 2001. 

Staatsgalerie Stuttgart, Edouard Manet und die Impressionisten, September 21, 2002-February 9, 2003, cat. 9 (ill.).

Fort Worth, Tex., Kimbell Museum of Art, The Impressionists: Master Paintings from the Art Institute of Chicago, June 29–November 2, 2008, cat. 7 (ill.).

The Art Institute of Chicago, Degas: At the Track, On the Stage, July 1, 2015-February 26, 2016, no cat.

Wuppertal, Von der Heydt-Museum, Edouard Manet, October 22, 2017-February 25, 2018.

Washington, DC, The Phillips Collection, An Italian Impressionist in Paris: Giuseppe De Nittis, Nov. 12, 2022-Feb. 12, 2023, pl. 39.

Paris, Musée d’Orsay, Manet/Degas, Mar. 27-July 23, 2023, cat. 68; New York, Metropolitan Museum of Art, Sep. 12, 2023-Jan. 7, 2024, pl. 101.",False,1866,Painting and Sculpture of Europe,Painting
243884,"Jacques de Gheyn II
Dutch 1565-1629","A Soldier Loading a Musket, ""Ramme in Your Pouder""","Rotterdam, Museum Boymans-van Beuningen, Jacques de Gheyn II Drawings, Dec. 13, 1985–Sept. 2, 1986, cat.17; also Washington D.C., The National Gallery of Art, Sept. 3–Nov. 5, 1986.

The Art Institute of Chicago, ""Rubens, Rembrandt, and Drawing in the Golden Age"", September 28, 2019 - January 5, 2020, pp. 212, 213 (ill.), 214-15, 279, 298, 331, cat. 76, cat. by Victoria Sancho Lobis, et. al.

The Art Institute of Chicago, ""Pure Drawing: Seven Centuries of Art from the Gray Collection"", January 25 - May 10, 2020, p. 48-49, cat. 19, p. 115, fig. 19.1, p. 133, GC 27, traveled to Berkeley, CA, August 4 - November 28, 2021.",False,1596/98,Prints and Drawings,Drawing and Watercolor
65032,"Olga de Amaral (Colombian, born 1932)
Bogotá, Columbia",Alquimia III (Alchemy III),"Art Institute of Chicago, Elizabeth F. Cheney and Agnes Allerton Textile Galleries, Gift, Bequest and Purchase: A Selection of Textile Acquisitions from 1982–1987, Mar. 18–Aug. 14, 1989.

Art Institute of Chicago, Elizabeth F. Cheney and Agnes Allerton Textile Galleries, Twenty Years of Textile Society Collecting (1978–1998), Dec. 20, 1997–Mar. 22, 1998.",True,1983,Textiles,Textile
269504,"María Dávila (Venezuelan, born 1966)
Eduardo Portillo (Venezuelan, born 1966)",White Dwarf,"Savannah, GA, Indigo and Beyond, Cross Currents: Land, Labor, and the Port, Oct 19-23, 2016 (organized by the Textile Society of America for its 15th Biennial conference symposium exhibition). 

Albuquerque, NM, Albuquerque Museum, Indelible Blue: Indigo Around the World, Jan. 8- Apr. 24, 2022. https://www.cabq.gov/artsculture/albuquerque-museum/past-exhibits/indelible-blue.",True,2016,Textiles,Textile
258964,"David Goldblatt
South African, 1930-2018","At Geel, near Nietverdiend, Marico Bushveld, Transvaal (North-West Province), December 1964",,False,1964,Photography and Media,Photograph
95425,Armenia,Fragment,,False,16th century,Textiles,Textile
45322,"Pablo Picasso (Spanish, 1881-1973)
printed by Fernand Mourlot (French, 1895–1988)",Paloma and Her Doll on a Black Background,,True,"December 14, 1952",Prints and Drawings,Print
234462,"Jim Nutt
American, born 1938",Wowidow,,False,1968,Contemporary Art,Painting
184107,"Ellen Gallagher
American, born 1965",Untitled,,False,1999,Contemporary Art,Painting
151364,"Jackson Pollock
American, 1912-1956",Untitled,"London, Marlborough Fine Art, “Jackson Pollock,” June 1961, cat. 26, as “Painting, c. 1938.”

Kunstverein für die Rheinlande und Westfalen, Düsseldorf Kunsthalle, “Jackson Pollock,” Sept. 5–Oct. 8, 1961, cat. 35, as “Painting, c. 1938.”

Kunsthaus Zürich, “Jackson Pollock,” Oct. 24–Nov. 29, 1961, cat. 35, as “Painting, c. 1938.” 

Rome, Marlborough Galleria d’Arte, “Jackson Pollock,” Oct.–Nov. 1962; Milan, Toninelli Arte Moderna, Nov.–Dec. 1962, cat. 18, as “Painting, c. 1938.

Stockholm, Moderna Museet, “Jackson Pollock,” Feb. 27–Apr. 15, 1963, cat. 35, as “Painting, 1938.”

New York, Marlborough-Gerson Gallery, “Jackson Pollock,” Jan. 14–Feb. 15, 1964, cat. 40, as “Painting, c. 1938.”

East Hampton, NY, Guild Hall Museum, “Krasner/Pollock: A Working Relationship,” Aug. 8–Oct. 4, 1981; New York, Grey Art Gallery and Study Center, New York University, Nov. 3–Dec. 12, 1981, cat. 20, as “Composition with Donkey Head.”

Munich, ACA Gallery, “Jackson Pollock,” Sept. 1993, cat. 1, as “Composition with Donkey Head.”

Kunsthalle Düsseldorf, “Siqueiros/Pollock, Pollock/Siqueiros,” Sept. 30–Dec. 3, 1995, no cat. no., as “Composition with Donkey Head.”

Houston, Museum of Fine Arts, “Jackson Pollock: Defining the Heroic,” Mar. 2–June 30, 1996, cat. 5. 

New York, Joan T. Washburn Gallery, “Pollock, Orozco and Siqueiros,” Jan. 21–Feb. 28, 1998.

Chicago, Art Institute of Chicago, America after the Fall: Painting in the 1930s, June 5–Sept. 18, 2016; Paris, Établissement public du musée d‘Orsay et du musée de l‘Orangerie, Oct. 11, 2016–Jan. 30, 2017; London, Royal Academy of Arts, Feb. 25–June 4, 2017.

Shanghai Museum, Pathways to Modernism: American Art, 1865–1945, Sept. 28, 2018–Jan. 6, 2019.

New York, Whitney Museum of American art, Vida Americana: Mexican Muralists Remake American Art, 1925-1945, Feb. 17-May 17, 2020, cat. 109; San Antonio, McNay Art Museum, June 25-Oct. 4, 2020 (extended at the Whitney until Jan. 31, 2021 due to the COVID-19 pandemic. McNay Art Museum portion of the tour was canceled.",True,c. 1938–41,Contemporary Art,Painting
109886,"Karl Wirsum
American, 1939-2021",Screamin' Jay Hawkins,,False,1968,Contemporary Art,Painting
185019,"Dieter Roth
Swiss, born Germany, 1930-1998",Piccadilly Triptych,,False,1968–70,Prints and Drawings,Drawing and Watercolor
260645,"János Megyik
Hungarian, born 1938",Drawing (Geometric Construction for Corpus),,False,1988,Prints and Drawings,Drawing and Watercolor
118570,"Daniel Chester French (American, 1850–1931)","Bust of Mary Harris Thompson, M. D.",,False,1902,Arts of the Americas,Sculpture
146929,"Joseph Mozier (American, 1812–1870)",Pocahontas,,False,1868,Arts of the Americas,Sculpture
107863,"Hiram Powers
American, 1805–1873",Ginevra,,False,1865–68,Arts of the Americas,Sculpture
64076,"Hiram Powers
American, 1805–1873",America,"Beloit College, Wis., Theodore Lyman Wright Art Center, 1932–1972.",False,1850–54,Arts of the Americas,Sculpture
260557,"Giovanni Battista Balestra (Italian, 1774-1842)
after a drawing by Giovanni Tognolli (Italian, 1786-1862)
after the sculpture of Antonio Canova (Italian, 1757-1822)","Paris Leaning on Tree Stump, Front View, from Oeuvre de Canova",,False,1817,Prints and Drawings,Print
260559,"Angelo Bertini (Italian, born 1783)
after a drawing by Giovanni Tognolli (Italian, 1786-1862)
after the sculpture of Antonio Canova (Italian, 1757-1822)","Ettore, Front View, from Oeuvre de Canova",,False,1817,Prints and Drawings,Print
260558,"Angelo Testa (Italian, born c. 1775)
after a drawing by Giovanni Tognolli (Italian, 1786-1862)
after the sculpture of Antonio Canova (Italian, 1757-1822)","Paris Leaning on Tree Stump, Back View, from Oeuvre de Canova",,False,1817,Prints and Drawings,Print
260565,"Domenico Marchetti (Italian, c. 1780-after1844)
after a drawing by Giovanni Tognolli (Italian, 1786-1862)
after the sculpture of Antonio Canova (Italian, 1757-1822)","George Washington, Back View, from Oeuvre de Canova",,False,1817,Prints and Drawings,Print
260563,"Domenico Marchetti (Italian, c. 1780-after1844)
after a drawing by Giovanni Tognolli (Italian, 1786-1862)
after the sculpture of Antonio Canova (Italian, 1757-1822)","The Three Graces, Back View, from Oeuvre de Canova",,False,1817,Prints and Drawings,Print
260560,"Pietro Bonato (Italian, 1765-1820)
after a drawing by Giovanni Tognolli (Italian, 1786-1862)
after the sculpture of Antonio Canova (Italian, 1757-1822)","Ettore, Side View, from Oeuvre de Canova",,False,1817,Prints and Drawings,Print
135132,Egyptian,Box for a Mummified Animal with Cobra Figure,,False,Late Period–Ptolemaic Period (664–30 BCE),Arts of Africa,Sculpture
136433,Egyptian,"Statuette of a Lion-headed God, probably Horus of Buto","Art Institute of Chicago, When the Greeks Ruled: Egypt After Alexander the Great, October 31, 2013 - July 27, 2014; traveled to New York City, NY, the Institute for the Study of the Ancient World, October 8, 2014 - January 4, 2015.",False,Late Period (664–332 BCE),Arts of Africa,Sculpture
57994,"Designed by Jean Lurçat (French, 1892–1966)
France",Carpet,"Art Institute of Chicago, Agnes Allerton Gallery, European Carpets from the Permanent Collection, Mar. 6–June 6, 1982.

Art Institute of Chicago, Elizabeth F. Cheney and Agnes Allerton Textile Galleries, On or Off the Wall: An International Selection of Tapestries and Carpets, 1920s–1970s, May 14, 2003–Feb. 8, 2004.",False,1920/29,Textiles,Textile
144967,China,Bell (Duo),,True,"Eastern Zhou dynasty, Warring States period (480–221 B.C.), c. 4th century B.C.",Arts of Asia,Decorative Arts
140599,"Zhang Yin 張崟
Chinese, 1761-1829",Mansion by the River 青櫺歸隱圖,,False,"Qing dynasty (1644–1911), 1810 清朝",Arts of Asia,Painting
61483,"Wang Meng 王蒙 (Chinese, c. 1308-1385)",Quiet Life in a Wooded Glen 林麓幽居圖,The Art Institute of Chicago : Ming (1368-1644) Ching (1644-1921) dynasties Exhibition 1964,False,"Yuan dynasty (1279–1368), dated 1361",Arts of Asia,Painting
36492,"Francesco de Mura
Italian, 1696-1782",Charity,"London, Heim Gallery, May 13–August 28, 1971, no. 14.

Detroit, Institute of Arts, The Golden Age of Naples: Art and Civilization under the Bourbons 1734–1805, Aug. 11–Nov. 1, 1981, no. 34; Art Institute of Chicago, Jan. 16–Mar. 8, 1982.

Worcester, Massachusetts, Art Museum, Hope and Healing: Painting in Italy in a Time of Plague 1500–1800, Apr. 3–Sep. 25, 2005, cat. 9 (ill.).

Winter Park, Florida, Cornell Fine Arts Museum, In the Light of Naples: The Art of Francesco de Mura, Sep. 17–Dec. 18, 2016, cat. 19; Madison, Chazen Museum of Art, Jan. 20–Apr. 2, 2017; Arlington, NY, Frances Lehman Loeb Art Center, Apr. 21–July 2, 2017 [Winter Park and Madison only].",False,1743/44,Painting and Sculpture of Europe,Painting
76279,"Artist Unknown
Chinese",Yang Pu Moving His Family,,False,Yuan dynasty (1279–1368) 元朝,Essentials,Painting
